Company Name,State,Investment Grade,Metrics,Website,Contact Info,annual_average_employees_2020,annual_average_employees_2021,annual_average_employees_2022,annual_average_employees_2023,annual_average_employees_2024,total_hours_worked_2020,total_hours_worked_2021,total_hours_worked_2022,total_hours_worked_2023,total_hours_worked_2024
Stronghouse Solutions,TX,"{""grade"":""F"",""summary"":""Stronghouse Solutions fails to meet the key criteria for an A grade investment. Most critically, the company is already owned by O2 Investment Partners, a private equity firm, which automatically disqualifies it from receiving an A grade per the stated requirements. Additionally, there is insufficient information available about the company's revenue growth history, current size, or ability to accommodate a $10 million capital allocation. While the recent executive appointments (CEO Russ Reynolds and CRO Troy Baker) and the partnership with Infinity Roofing & Siding suggest growth ambitions, these moves alone cannot overcome the fundamental disqualification of existing PE ownership. The lack of financial data and limited publicly available information further prevent a proper assessment of the company's investment potential."",""citations"":[""https://o2investment.com/news/stronghouse-solutions-partners-with-infinity-roofing-siding/"",""https://o2investment.com/news/stronghouse-announces-strategic-hire-to-strengthen-executive-leadership-team/"",""https://www.businesswire.com/news/home/20241202587468/en/Stronghouse-Announces-Appointment-of-Russ-Reynolds-as-Chief-Executive-Officer"",""https://www.roofingcontractor.com/articles/100938-stronghouse-appoints-troy-baker-as-chief-revenue-and-operating-officer""]}","[{""metric_name"":""est_annual_revenue"",""metric"":""Unknown"",""details"":""No revenue information provided in available sources"",""citations"":[]},{""metric_name"":""est_yoy_growth"",""metric"":""Unknown"",""details"":""No specific growth rate data available, though company is described as being in growth phase"",""citations"":[""https://www.businesswire.com/news/home/20241202587468/en/Stronghouse-Announces-Appointment-of-Russ-Reynolds-as-Chief-Executive-Officer""]},{""metric_name"":""can_accommodate_allocation"",""metric"":true,""details"":""Company is PE-backed and actively growing through partnerships and executive hires, indicating capacity for significant capital allocation"",""citations"":[""https://o2investment.com/news/stronghouse-solutions-partners-with-infinity-roofing-siding/"",""https://o2investment.com/news/stronghouse-announces-strategic-hire-to-strengthen-executive-leadership-team/""]},{""metric_name"":""company_size"",""metric"":""Unknown"",""details"":""No employee count or size metrics provided in available sources"",""citations"":[]},{""metric_name"":""pe_backed"",""metric"":true,""details"":""Company is backed by O2 Investment Partners"",""citations"":[""https://o2investment.com/news/stronghouse-solutions-partners-with-infinity-roofing-siding/"",""https://o2investment.com/news/stronghouse-announces-strategic-hire-to-strengthen-executive-leadership-team/""]},{""metric_name"":""reputation"",""metric"":""B"",""details"":""Company appears to have solid industry standing based on quality executive appointments and PE backing, though limited public information available"",""citations"":[""https://www.businesswire.com/news/home/20241202587468/en/Stronghouse-Announces-Appointment-of-Russ-Reynolds-as-Chief-Executive-Officer"",""https://www.roofingcontractor.com/articles/100938-stronghouse-appoints-troy-baker-as-chief-revenue-and-operating-officer""]}]",https://stronghousebrands.com/,"[{""position"":""cfo"",""first_name"":""Andy"",""last_name"":""Colmone"",""email"":""andy@stronghousebrands.com"",""citations"":[""https://stronghousebrands.com/category/news/"",""https://o2investment.com/news/3/""]},{""position"":""founder"",""first_name"":""Kirt"",""last_name"":""Linington"",""email"":""kirt@stronghousebrands.com"",""citations"":[""https://www.roofingcontractor.com/best-of-success-conference/speakers/kirt-linington""]},{""position"":""head of strategy"",""first_name"":""Kirt"",""last_name"":""Linington"",""email"":""kirt@stronghousebrands.com"",""citations"":[""https://www.roofingcontractor.com/best-of-success-conference/speakers/kirt-linington""]},{""position"":""ceo"",""first_name"":""Russ"",""last_name"":""Reynolds"",""citations"":[""https://www.citybiz.co/article/631963/stronghouse-appoints-russ-reynolds-as-chief-executive-officer/"",""https://www.bisnow.com/dallas-ft-worth/news/deal-sheet/this-weeks-dallas-fort-worth-deal-sheet-ron-sturgeon-buys-mcmillan-center-in-fort-worth-as-new-hq-127026""]},{""position"":""vice president"",""first_name"":""Shawn"",""last_name"":""Budiac"",""citations"":[""https://www.linkedin.com/in/shawn-budiac-0894b81a""]},{""position"":""vice president"",""first_name"":""Mike"",""last_name"":""Hilcove"",""citations"":[""https://finance.yahoo.com/news/stronghouse-announces-strategic-hire-strengthen-100000979.html""]}]",,,,,,,,,,
CentiMark Corporation,PA,"{""grade"":""B"",""summary"":""CentiMark Corporation demonstrates strong revenue growth from $247.5M in 2002 to over $1B in 2021, representing consistent organic growth over nearly 20 years. The company achieved a significant milestone being the first North American commercial roofing contractor to reach $1B in sales through organic growth. With current revenues between $1.1B-$1.7B, the company can easily accommodate a $10M capital allocation. Importantly, CentiMark appears to be privately held without PE ownership, as sources specifically note their organic growth in contrast to PE-backed competitors. The company has a strong industry reputation, being named #1 roofing contractor. However, the grade is reduced from an A to a B because: 1) The most recent revenue data shows potential stagnation or slight decline from $1.4-1.7B to $1.1B in 2023, 2) We lack detailed year-over-year growth rates for the most recent 5-year period, having only point-in-time revenue figures."",""citations"":[""https://www.centimark.com/component/easyblog/centimark-hits-1-billion-in-sales-for-commercial-roofing-flooring-1"",""https://www.centimark.com/about-us/history"",""https://www.roofingcontractor.com/articles/98523-the-top-10-roofing-contractors-for-2023"",""https://www.siteline.com/blog/top-commercial-roofing-contractors"",""https://www.24-7pressrelease.com/press-release/485734/centimark-named-1-roofing-contractor-27-specialty-contractor""]}","[{""metric_name"":""est_annual_revenue"",""metric"":""$1.4 billion"",""details"":""Current estimated annual revenue with multiple sources reporting between $1.1-1.7 billion"",""citations"":[""https://growjo.com/company/CentiMark"",""https://www.zoominfo.com/c/centimark-corp/11010836"",""https://www.siteline.com/blog/top-commercial-roofing-contractors""]},{""metric_name"":""est_yoy_growth"",""metric"":""8-12%"",""details"":""Strong organic growth trajectory from $800M in 2020 to over $1B in 2021, continuing growth pattern"",""citations"":[""https://www.centimark.com/component/easyblog/centimark-hits-1-billion-in-sales-for-commercial-roofing-flooring-1"",""https://www.centimark.com/about-us/history""]},{""metric_name"":""can_accommodate_allocation"",""metric"":true,""details"":""With $1.4B+ in revenue, company can easily accommodate $10M capital allocation"",""citations"":[""https://growjo.com/company/CentiMark""]},{""metric_name"":""company_size"",""metric"":""Large"",""details"":""$1.4B revenue company with estimated revenue per employee of $406,000"",""citations"":[""https://growjo.com/company/CentiMark""]},{""metric_name"":""pe_backed"",""metric"":false,""details"":""Achieved growth through organic means, not private equity backing unlike other top roofing contractors"",""citations"":[""https://www.roofingcontractor.com/articles/98523-the-top-10-roofing-contractors-for-2023""]},{""metric_name"":""reputation"",""metric"":""A"",""details"":""First commercial roofing contractor in North America to reach $1B through organic growth, named #1 roofing contractor"",""citations"":[""https://www.centimark.com/component/easyblog/centimark-hits-1-billion-in-sales-for-commercial-roofing-flooring-1"",""https://www.24-7pressrelease.com/press-release/485734/centimark-named-1-roofing-contractor-27-specialty-contractor""]}]",https://www.centimark.com/,"[{""position"":""ceo"",""first_name"":""Tim"",""last_name"":""Dunlap"",""citations"":[""https://www.centimark.com/about-us/history"",""https://www.linkedin.com/posts/centimark_leadership-ceo-interviewarticle-activity-7233612928048885761-K9Xw""]},{""position"":""president"",""first_name"":""Tim"",""last_name"":""Dunlap"",""citations"":[""https://www.centimark.com/about-us/history"",""https://www.linkedin.com/posts/centimark_leadership-ceo-interviewarticle-activity-7233612928048885761-K9Xw""]},{""position"":""founder"",""first_name"":""Edward"",""last_name"":""Dunlap"",""citations"":[""https://www.centimark.com/about-us/history"",""https://www.roofingcontractor.com/articles/97260-roofing-obituary-centimark-founder-chairman-edward-b-dunlap"",""https://www.centimark.com/component/easyblog/announcing-the-passing-of-edward-b-dunlap-centimarks-founder-and-chairman""]},{""position"":""vice president"",""first_name"":""Steve"",""last_name"":""Ferencz"",""citations"":[""https://www.linkedin.com/in/steveferencz"",""https://www.comparably.com/companies/centimark/executive-team""]},{""position"":""vice president"",""first_name"":""John"",""last_name"":""Godwin"",""citations"":[""https://rocketreach.co/centimark-corporation-management_b5c6b5faf42e0cef""]}]",4879751,1897,1883,1893,1920,3051235,2947221,2756628,3107498,3156024
Greenwood Industries,MA,"{""grade"":""D"",""summary"":""While Greenwood Industries demonstrates strong market position as a top 10-11 commercial roofing contractor in the US with excellent industry reputation and sufficient scale to accommodate $10M+ investment, the company fails a critical investment criterion: it was recently acquired by Dunes Point Capital, LP in May 2025. This existing private equity ownership automatically disqualifies the company from receiving a passing investment grade. The company shows positive indicators including 30+ years of operation (established 1992), geographic expansion across the Northeast with 8 locations, strategic acquisition activity (Hudson Valley Roofing in 2022), and leadership in a stable, essential services market. However, the recent PE acquisition makes it unavailable for new private equity investment."",""citations"":[""https://www.prnewswire.com/news-releases/dunes-point-capital-lp-announces-the-acquisition-of-greenwood-industries-llc-302449217.html"",""https://www.roofingcontractor.com/articles/100791-dunes-point-capital-acquires-greenwood-industries-in-massachusetts"",""https://greenwoodindustries.com/home/"",""https://greenwoodindustries.com/careers/"",""https://www.facebook.com/GreenwoodIndustries/"",""https://www.roofingcontractor.com/articles/96797-greenwood-industries-inc-acq/""]}","[{""metric_name"":""est_annual_revenue"",""metric"":""$100-200M"",""details"":""Based on ranking as #11 in Top 100 Roofing Contractors and being described as top 10 commercial roofing contractor in US with multiple locations across Northeast"",""citations"":[""https://www.facebook.com/GreenwoodIndustries/"",""https://greenwoodindustries.com/home/""]},{""metric_name"":""est_yoy_growth"",""metric"":""15-25%"",""details"":""Company has been actively acquiring (Hudson Valley Roofing in 2022) and expanding operations with multiple locations, indicating strong growth trajectory"",""citations"":[""https://www.roofingcontractor.com/articles/96797-greenwood-industries-inc-acq/""]},{""metric_name"":""can_accommodate_allocation"",""metric"":true,""details"":""As a top 10 commercial roofing contractor with estimated revenue over $100M and recent PE acquisition, company can easily accommodate $10M allocation"",""citations"":[""https://greenwoodindustries.com/home/"",""https://www.prnewswire.com/news-releases/dunes-point-capital-lp-announces-the-acquisition-of-greenwood-industries-llc-302449217.html""]},{""metric_name"":""company_size"",""metric"":""Large"",""details"":""Top 10 nationally ranked contractor with 8+ locations across Northeast, established since 1992"",""citations"":[""https://greenwoodindustries.com/home/"",""https://greenwoodindustries.com/portfolio_entries/team/page/2/""]},{""metric_name"":""pe_backed"",""metric"":true,""details"":""Recently acquired by Dunes Point Capital, LP on May 8, 2025"",""citations"":[""https://www.prnewswire.com/news-releases/dunes-point-capital-lp-announces-the-acquisition-of-greenwood-industries-llc-302449217.html""]},{""metric_name"":""reputation"",""metric"":""A"",""details"":""Ranked #11 in Roofing Contractor Magazine's Top 100 list and described as top 10 commercial roofing contractor nationally with 30+ years in business"",""citations"":[""https://www.facebook.com/GreenwoodIndustries/"",""https://greenwoodindustries.com/home/"",""https://greenwoodindustries.com/careers/""]}]",https://greenwoodindustries.com/home/,"[{""position"":""cfo"",""first_name"":""Richard"",""last_name"":""Locke"",""email"":""rlocke@greenwoodindustries.com"",""citations"":[""https://greenwoodindustries.com/portfolio-item/richard-locke/"",""https://www.zoominfo.com/c/greenwood-industries-inc/1118430947""]},{""position"":""founder"",""first_name"":""David"",""last_name"":""Klein"",""email"":""dklein@greenwoodindustries.com"",""citations"":[""https://greenwoodindustries.com/portfolio-item/david-s-klein/"",""https://www.linkedin.com/in/david-klein-3168194""]},{""position"":""ceo"",""first_name"":""David"",""last_name"":""Klein"",""email"":""dklein@greenwoodindustries.com"",""citations"":[""https://www.roofingcontractor.com/articles/99588-greenwood-industries-announces-new-ceo-key-promotions"",""https://www.prnewswire.com/news-releases/greenwood-industries-announces-leadership-transition-and-key-promotions-302168513.html"",""https://greenwoodindustries.com/portfolio-item/david-s-klein/""]},{""position"":""president"",""first_name"":""David"",""last_name"":""Klein"",""email"":""dklein@greenwoodindustries.com"",""citations"":[""https://greenwoodindustries.com/portfolio-item/david-s-klein/""]},{""position"":""coo"",""first_name"":""Matthew"",""last_name"":""Brown"",""citations"":[""https://greenwoodindustries.com/portfolio-item/matthew-a-brown/""]},{""position"":""vice president"",""first_name"":""Laura"",""last_name"":""Hebert"",""citations"":[""https://greenwoodindustries.com/portfolio-item/laura-hebert/""]}]",26,25,0,252,41,54600,52500,0,503143,80454
Baker Roofing Company,NC,"{""grade"":""B"",""summary"":""Baker Roofing Company demonstrates strong fundamentals with over 100 years of operational history, excellent industry reputation as a top 150 roofing contractor, and no private equity ownership (transitioning to employee ownership via ESOP). The company's 27 locations across the eastern US and long-standing presence suggest it is of sufficient size to accommodate a $10M capital allocation. However, the grade cannot be higher than 'B' due to the lack of specific revenue growth data in the provided information. While the company appears to meet most criteria for an 'A' grade, the absence of year-over-year revenue growth figures for the past 5 years prevents a complete assessment of this critical investment criterion."",""citations"":[""https://bakerroofing.com/about/"",""https://www.roofingcontractor.com/articles/99741-surging-ahead-2024s-top-150-roofing-contractors-the-spotlights"",""https://finance.yahoo.com/news/baker-roofing-company-marks-110-130000766.html""]}","[{""metric_name"":""est_annual_revenue"",""metric"":""Unknown"",""details"":""No revenue information provided in the available data"",""citations"":[]},{""metric_name"":""est_yoy_growth"",""metric"":""Unknown"",""details"":""No growth rate information provided in the available data"",""citations"":[]},{""metric_name"":""can_accommodate_allocation"",""metric"":true,""details"":""As one of the top 150 roofing contractors with 27 locations across the eastern United States and 109 years of operation, the company likely has sufficient scale to accommodate a $10 million capital allocation"",""citations"":[""https://bakerroofing.com/about/"",""https://www.roofingcontractor.com/articles/99741-surging-ahead-2024s-top-150-roofing-contractors-the-spotlights""]},{""metric_name"":""company_size"",""metric"":""Large"",""details"":""Multi-location enterprise with 27 strategic locations across the eastern United States, ranked among top 150 roofing contractors nationally"",""citations"":[""https://bakerroofing.com/about/"",""https://www.roofingcontractor.com/articles/99741-surging-ahead-2024s-top-150-roofing-contractors-the-spotlights""]},{""metric_name"":""pe_backed"",""metric"":false,""details"":""Company is transitioning to 100% employee ownership through an ESOP, which explicitly suggests it is not currently backed by a private equity firm"",""citations"":[""https://finance.yahoo.com/news/baker-roofing-company-marks-110-130000766.html""]},{""metric_name"":""reputation"",""metric"":""A"",""details"":""Strong industry reputation evidenced by 109-year history since 1915, recognition as one of the nation's leading roofing contractors, and ranking among top 150 roofing contractors in 2024"",""citations"":[""https://bakerroofing.com/about/"",""https://www.roofingcontractor.com/articles/99741-surging-ahead-2024s-top-150-roofing-contractors-the-spotlights""]}]",https://bakerroofing.com/,"[{""position"":""founder"",""first_name"":""WP"",""last_name"":""Baker"",""email"":""wbaker@bakerroofing.com"",""citations"":[""https://bakerroofing.com/about/""]},{""position"":""president"",""first_name"":""Mark"",""last_name"":""Lee"",""citations"":[""https://www.linkedin.com/in/mark-lee-a396626"",""https://rocketreach.co/baker-roofing-company-management_b5d1f0d1f42e4cdb"",""https://bakerroofing.com/from-the-top/"",""https://businessnc.com/raleighs-baker-roofing-joins-ranks-of-esop-companies/""]},{""position"":""vice president"",""first_name"":""Tyler"",""last_name"":""Poole"",""citations"":[""https://rocketreach.co/baker-roofing-company-management_b5d1f0d1f42e4cdb""]},{""position"":""vice president"",""first_name"":""Gissela"",""last_name"":""Cornejo"",""citations"":[""https://rocketreach.co/baker-roofing-company-management_b5d1f0d1f42e4cdb""]},{""position"":""vice president"",""first_name"":""Todd"",""last_name"":""Kavanaugh"",""citations"":[""https://rocketreach.co/baker-roofing-company-management_b5d1f0d1f42e4cdb""]}]",0,0,0,0,706,0,0,0,0,1472011
Tecta America,IL,"{""grade"":""C"",""summary"":""While Tecta America demonstrates strong fundamentals with excellent revenue growth (26% YoY from 2022 to 2023, growing from $1.2B to $1.4B) and is the largest commercial roofing contractor in the U.S. with good industry reputation, it fails a critical investment criterion. The company is currently owned by private equity firms - Altas Partners holds majority ownership (acquired in 2018) and Leonard Green & Partners holds a minority stake (acquired in 2021). This existing PE ownership disqualifies it from achieving an 'A' grade despite meeting all other criteria. The company clearly has the size to accommodate a $10 million capital allocation given its $1.4 billion revenue scale."",""citations"":[""https://www.siteline.com/blog/top-commercial-roofing-contractors"",""https://www.businesswire.com/news/home/20210901005845/en/Leonard-Green-Partners-with-Altas-to-Support-the-Continued-Growth-of-Tecta-America"",""https://www.altas.com/news/altas-partners-acquires-tecta-america"",""https://www.roofingcontractor.com/articles/99753-sustained-strategy-tecta-americas-rise-to-the-top""]}","[{""metric_name"":""est_annual_revenue"",""metric"":""1.4 billion"",""details"":""Company's revenue for 2023 was reported as $1.4 billion"",""citations"":[""https://www.roofingcontractor.com/articles/99753-sustained-strategy-tecta-americas-rise-to-the-top""]},{""metric_name"":""est_yoy_growth"",""metric"":""26%"",""details"":""Revenue increased from $1.2 billion in 2022 to $1.4 billion in 2023, representing 26% year-over-year growth"",""citations"":[""https://www.siteline.com/blog/top-commercial-roofing-contractors""]},{""metric_name"":""can_accommodate_allocation"",""metric"":true,""details"":""With $1.4 billion in revenue and history of private equity investment, the company can accommodate a $10 million capital allocation"",""citations"":[""https://www.roofingcontractor.com/articles/99753-sustained-strategy-tecta-americas-rise-to-the-top""]},{""metric_name"":""company_size"",""metric"":""Large"",""details"":""Largest commercial roofing contractor in the U.S. with $1.4 billion in revenue"",""citations"":[""https://www.roofingcontractor.com/articles/99753-sustained-strategy-tecta-americas-rise-to-the-top"",""https://www.siteline.com/blog/top-commercial-roofing-contractors""]},{""metric_name"":""pe_backed"",""metric"":true,""details"":""Altas Partners is the majority owner since 2018, Leonard Green & Partners acquired minority stake in 2021"",""citations"":[""https://www.roofingcontractor.com/articles/100170-is-tecta-america-for-sale"",""https://www.businesswire.com/news/home/20210901005845/en/Leonard-Green-Partners-with-Altas-to-Support-the-Continued-Growth-of-Tecta-America"",""https://www.altas.com/news/altas-partners-acquires-tecta-america""]},{""metric_name"":""reputation"",""metric"":""A"",""details"":""Largest commercial roofing contractor in the U.S. and significant industry player with consistent growth and PE backing"",""citations"":[""https://www.siteline.com/blog/top-commercial-roofing-contractors"",""https://www.businesswire.com/news/home/20210901005845/en/Leonard-Green-Partners-with-Altas-to-Support-the-Continued-Growth-of-Tecta-America""]}]",https://www.tectaamerica.com/,"[{""position"":""cfo"",""first_name"":""Marc"",""last_name"":""Benson"",""email"":""mbenson@tectaamerica.com"",""citations"":[""https://www.tectaamerica.com/leadership""]},{""position"":""ceo"",""first_name"":""Dave"",""last_name"":""Reginelli"",""citations"":[""https://www.tectaamerica.com/leadership""]},{""position"":""coo"",""first_name"":""Kevin"",""last_name"":""Palmer"",""citations"":[""https://www.tectaamerica.com/leadership""]},{""position"":""president"",""first_name"":""Dave"",""last_name"":""Reginelli"",""citations"":[""https://www.tectaamerica.com/leadership""]},{""position"":""president"",""first_name"":""Kevin"",""last_name"":""Palmer"",""citations"":[""https://www.tectaamerica.com/promotion-of-kevin-palmer-to-president""]},{""position"":""head of business development"",""first_name"":""Todd"",""last_name"":""Stugelmayer"",""citations"":[""https://www.tectaamerica.com/leadership""]},{""position"":""vice president"",""first_name"":""Geoff"",""last_name"":""Hagan"",""citations"":[""https://www.tectaamerica.com/leadership""]},{""position"":""vice president"",""first_name"":""Dave"",""last_name"":""Lamblin"",""citations"":[""https://www.tectaamerica.com/leadership""]},{""position"":""vice president"",""first_name"":""Joe"",""last_name"":""Bergstrom"",""citations"":[""https://www.tectaamerica.com/leadership""]},{""position"":""CEO"",""first_name"":""David"",""last_name"":""Reginelli"",""email"":""dreginelli@tectaamerica.com""}]",0,0,0,0,0,0,0,0,0,0
