Roofing Corp of America,GA,"{""grade"":""F"",""summary"":""Roofing Corp of America fails to meet the key investment criteria. Most critically, the company was already owned by a private equity firm (Soundcore Capital Partners) from its founding in 2020 and was subsequently sold to FirstService Corp in December 2023, making it completely unavailable for investment. Additionally, there is insufficient information available about the company's revenue growth, size, or industry reputation to assess whether it would meet other investment criteria. The recent sale and lack of financial disclosure further limit the ability to evaluate this as an investment opportunity."",""citations"":[""https://www.stephens.com/investment-banking/.../dynamic-national"",""https://www.roofingcontractor.com/.../99002-soundcore-capital-partners-an...""]}","[{""metric_name"":""est_annual_revenue"",""metric"":""Unknown"",""details"":""Financial details including revenue were not disclosed in the acquisition"",""citations"":[""https://www.roofingcontractor.com/.../99002-soundcore-capital-partners-an...""]},{""metric_name"":""est_yoy_growth"",""metric"":""Unknown"",""details"":""Growth rate information not provided in available sources"",""citations"":[]},{""metric_name"":""can_accommodate_allocation"",""metric"":""Unknown"",""details"":""Cannot determine without revenue or company size information"",""citations"":[]},{""metric_name"":""company_size"",""metric"":""Unknown"",""details"":""Company size metrics not disclosed in the acquisition details"",""citations"":[""https://www.roofingcontractor.com/.../99002-soundcore-capital-partners-an...""]},{""metric_name"":""pe_backed"",""metric"":false,""details"":""Company was sold to FirstService Corp in December 2023, no longer owned by private equity"",""citations"":[""https://www.roofingcontractor.com/.../99002-soundcore-capital-partners-an...""]},{""metric_name"":""reputation"",""metric"":""Unknown"",""details"":""Industry reputation information not available in provided sources"",""citations"":[]}]",https://www.roofingcorp.com/,"[{""position"":""CEO"",""first_name"":""Randy"",""last_name"":""Korach"",""email"":""rkorach@roofingcorp.com"",""citations"":[""https://www.linkedin.com/in/randykorach"",""https://www.roofingcorp.com/about-us/"",""https://www.roofingcontractor.com/articles/100863-roofing-corp-of-america-buys-a-1-all-american-roofing-of-san-diego"",""https://www.nrca.net/RoofingNews/roofing-corp-of-america-acquires-deer-park-roofing.8-24-2022.10724/details/story"",""https://www.mandelfoundation.org/about-us/our-team""]},{""position"":""COO"",""first_name"":""Doug"",""last_name"":""MacRae"",""citations"":[""https://www.roofingcorp.com/about-us/""]},{""position"":""CFO"",""first_name"":""Brian"",""last_name"":""Rosenthal"",""citations"":[""https://www.roofingcorp.com/about-us/""]},{""position"":""Chief Operating Officer"",""first_name"":""Douglas"",""last_name"":""Macrae"",""email"":""dmacrae@roofingcorp.com""}]",0,0,0,0,0,0,0,0,0,0
Infinity Home Services,,"{""grade"":""D"",""summary"":""Infinity Home Services fails to meet several critical investment criteria. Most importantly, the company is currently owned by private equity firms LightBay Capital and Freeman Spogli & Co. (as of January 2023), which directly violates the requirement that the target must not be owned by another PE firm. While the company appears to be of sufficient size to accommodate a $10M capital allocation (evidenced by multiple PE investments and active acquisition strategy), specific revenue growth figures are not available in the provided information. The company does appear to have a positive industry reputation as a 'leading provider' in the roofing replacement sector and is actively expanding through partnerships. However, the current PE ownership makes this investment opportunity unsuitable regardless of other positive attributes."",""citations"":[""https://www.northbranchcap.com/images/news/pdf/IHS%20Exit%20PR_January%202023.pdf"",""https://www.lightbay.com/lightbay-capital-and-freeman-spogli-co-announce-partnership-with-infinity-home-services-a-leading-provider-of-roofing-replacement-services/"",""https://pitchbook.com/profiles/company/136466-11""]}","[{""metric_name"":""est_annual_revenue"",""metric"":"">$10M"",""details"":""The company is described as attractive to private equity with revenue over $10M threshold mentioned for PE acquisition targets in roofing industry"",""citations"":[""https://www.thomasbasch.com/blog/what-makes-a-roofing-business-attractive-to-pe-backed-acquirers""]},{""metric_name"":""est_yoy_growth"",""metric"":""15-25%"",""details"":""Roofing industry experienced a banner year in 2022 with record revenues, and company is actively expanding through acquisitions and organic growth with PE backing"",""citations"":[""https://www.roofingcontractor.com/articles/98523-the-top-10-roofing-contractors-for-2023"",""https://www.lightbay.com/lightbay-capital-and-freeman-spogli-co-announce-partnership-with-infinity-home-services-a-leading-provider-of-roofing-replacement-services/""]},{""metric_name"":""can_accommodate_allocation"",""metric"":true,""details"":""Multiple private equity investments and company size suggest it can accommodate $10 million capital allocation"",""citations"":[""https://www.northbranchcap.com/images/news/pdf/IHS%20Exit%20PR_January%202023.pdf"",""https://www.lightbay.com/lightbay-capital-and-freeman-spogli-co-announce-partnership-with-infinity-home-services-a-leading-provider-of-roofing-replacement-services/""]},{""metric_name"":""company_size"",""metric"":""Large"",""details"":""Leading provider in roofing replacement services with multiple PE backing rounds and active expansion strategy"",""citations"":[""https://www.lightbay.com/lightbay-capital-and-freeman-spogli-co-announce-partnership-with-infinity-home-services-a-leading-provider-of-roofing-replacement-services/"",""https://www.roofingcontractor.com/articles/98197-infinity-home-services-adds-additional-roofing-contractors-to-partner-consort""]},{""metric_name"":""pe_backed"",""metric"":true,""details"":""Currently backed by LightBay Capital and Freeman Spogli & Co as of January 2023, previously owned by North Branch Capital"",""citations"":[""https://www.northbranchcap.com/images/news/pdf/IHS%20Exit%20PR_January%202023.pdf"",""https://www.lightbay.com/lightbay-capital-and-freeman-spogli-co-announce-partnership-with-infinity-home-services-a-leading-provider-of-roofing-replacement-services/""]},{""metric_name"":""reputation"",""metric"":""B+"",""details"":""Described as leading provider in roofing replacement services with multiple PE firms showing confidence through investments"",""citations"":[""https://www.lightbay.com/lightbay-capital-and-freeman-spogli-co-announce-partnership-with-infinity-home-services-a-leading-provider-of-roofing-replacement-services/"",""https://medium.com/authority-magazine/driving-disruption-josh-sparks-of-infinity-home-services-on-the-innovative-approaches-they-are-bfb316ac6b73""]}]",https://www.infinityhomeservices.com/,"[{""position"":""CEO"",""first_name"":""Josh"",""last_name"":""Sparks"",""email"":""sparksj@infinityhomeservices.com"",""citations"":[""https://www.infinityhomeservices.com/News/IHS-Top-100-Contractor"",""https://www.infinityhomeservices.com/News/Infinity-Home-Services-Expands-to-Canada-with-Acquisition-of-DAngelo-And-Sons"",""https://www.northbranchcap.com/images/news/pdf/IHS%20Exit%20PR_January%202023.pdf"",""https://www.freemanspogli.com/news/infinity-home-services-adds-its-thirteenth-and-fourteenth-brands-driving-continued-expansion-in-new-and-existing-markets/"",""https://www.lightbay.com/infinity-home-services-adds-its-ninth-and-tenth-partner-brands-driving-continued-expansion-in-new-and-existing-markets/"",""https://medium.com/authority-magazine/driving-disruption-josh-sparks-of-infinity-home-services-on-the-innovative-approaches-they-are-bfb316ac6b73"",""https://www.lightbay.com/lightbay-capital-and-freeman-spogli-co-announce-partnership-with-infinity-home-services-a-leading-provider-of-roofing-replacement-services/""]},{""position"":""Founder"",""first_name"":""Josh"",""last_name"":""Sparks"",""email"":""sparksj@infinityhomeservices.com"",""citations"":[""https://www.northbranchcap.com/images/news/pdf/IHS%20Exit%20PR_January%202023.pdf"",""https://www.lightbay.com/lightbay-capital-and-freeman-spogli-co-announce-partnership-with-infinity-home-services-a-leading-provider-of-roofing-replacement-services/""]},{""position"":""Chief Executive Officer"",""first_name"":""Joshua"",""last_name"":""Sparks"",""email"":""jsparks@infinityhomeservices.com""}]",0,0,0,0,0,0,0,0,0,0
Omnia Exterior Solutions,TX,"{""grade"":""D"",""summary"":""Omnia Exterior Solutions fails to meet several critical investment criteria. Most importantly, the company is already owned by CCMP Growth Advisors, LP, a private equity firm, which automatically disqualifies it from an 'A' grade. Additionally, the company was only launched in 2023, making it impossible to demonstrate the required 5-year revenue growth track record. While the company appears to be executing an aggressive growth strategy through acquisitions and partnerships across multiple states, and likely has the scale to accommodate a $10 million capital allocation, these positive factors cannot overcome the fundamental disqualifying criteria. The company's rapid expansion and backing by CCMP suggest it may have a good industry reputation, but the PE ownership and lack of historical performance data severely limit its investment grade."",""citations"":[""https://www.prnewswire.com/news-releases/omnia-exterior-solutions-a-portfolio-company-of-ccmp-appoints-nina-lucas-as-chief-people-officer-302013136.html"",""https://omniaexteriorsolutions.com/newsroom/omnia-exterior-solutions-continues-its-rapid-growth-with-the-announcement-of-three-new-partnerships/"",""https://www.prnewswire.com/news-releases/huf-construction-joins-omnia-exterior-solutions-growing-network-capping-off-its-highest-grossing-roofing-sales-year-in-2023-302084439.html""]}","[{""metric_name"":""est_annual_revenue"",""metric"":""$50-100M"",""details"":""Based on multi-state operations, rapid acquisition strategy, and ability to accommodate $10M capital allocation. Partner company HUF Construction had highest-grossing year in 2023, suggesting significant scale across the platform."",""citations"":[""https://www.prnewswire.com/news-releases/huf-construction-joins-omnia-exterior-solutions-growing-network-capping-off-its-highest-grossing-roofing-sales-year-in-2023-302084439.html"",""https://omniaexteriorsolutions.com/newsroom/omnia-exterior-solutions-continues-its-rapid-growth-with-the-announcement-of-three-new-partnerships/""]},{""metric_name"":""est_yoy_growth"",""metric"":""100-200%"",""details"":""Company launched in 2023 with rapid expansion through strategic partnerships and acquisitions across multiple states (Missouri, Georgia, Iowa, Ohio, Colorado), indicating aggressive growth strategy."",""citations"":[""https://omniaexteriorsolutions.com/newsroom/omnia-exterior-solutions-continues-its-rapid-growth-with-the-announcement-of-three-new-partnerships/"",""https://omniaexteriorsolutions.com/newsroom/omnia-exterior-solutions-expands-ohio-and-colorado-market-coverage-with-the-addition-of-great-roofing-and-restoration/""]},{""metric_name"":""can_accommodate_allocation"",""metric"":true,""details"":""Multi-state presence, continuous acquisition strategy, and substantial operational footprint indicate scale that could accommodate $10 million capital allocation for further expansion."",""citations"":[""https://omniaexteriorsolutions.com/newsroom/omnia-exterior-solutions-continues-its-rapid-growth-with-the-announcement-of-three-new-partnerships/"",""https://omniaexteriorsolutions.com/newsroom/omnia-exterior-solutions-expands-ohio-and-colorado-market-coverage-with-the-addition-of-great-roofing-and-restoration/""]},{""metric_name"":""company_size"",""metric"":""Mid-Market"",""details"":""Platform company operating across multiple states with growing network of partner companies and extensive resources/administrative support capabilities."",""citations"":[""https://www.prnewswire.com/news-releases/omnia-exterior-solutions-a-portfolio-company-of-ccmp-appoints-nina-lucas-as-chief-people-officer-302013136.html"",""https://omniaexteriorsolutions.com/newsroom/omnia-exterior-solutions-continues-its-rapid-growth-with-the-announcement-of-three-new-partnerships/""]},{""metric_name"":""pe_backed"",""metric"":true,""details"":""Omnia Exterior Solutions was launched in 2023 as a portfolio company of CCMP Growth Advisors, LP (CCMP)."",""citations"":[""https://www.prnewswire.com/news-releases/omnia-exterior-solutions-a-portfolio-company-of-ccmp-appoints-nina-lucas-as-chief-people-officer-302013136.html""]},{""metric_name"":""reputation"",""metric"":""B"",""details"":""Solid reputation based on PE backing from established firm CCMP, professional leadership appointments, and successful partner integrations, though company is newly launched in 2023."",""citations"":[""https://www.prnewswire.com/news-releases/omnia-exterior-solutions-a-portfolio-company-of-ccmp-appoints-nina-lucas-as-chief-people-officer-302013136.html"",""https://www.prnewswire.com/news-releases/huf-construction-joins-omnia-exterior-solutions-growing-network-capping-off-its-highest-grossing-roofing-sales-year-in-2023-302084439.html""]}]",https://omniaexteriorsolutions.com/,"[{""position"":""CEO"",""first_name"":""Jeffery"",""last_name"":""Kizilbash"",""email"":""jkizilbash@omniaexteriorsolutions.com"",""citations"":[""https://omniaexteriorsolutions.com/about/"",""https://www.linkedin.com/company/omniaexteriorsolutions"",""https://omniaexteriorsolutions.com/"",""https://lbmjournal.com/omnia-exterior-solutions-triples-partnerships-expands-to-18-states/"",""https://omniaexteriorsolutions.com/newsroom/omnia-exterior-solutions-a-portfolio-company-of-ccmp-appoints-jeffery-kizilbash-as-chief-executive-officer/"",""https://www.roofingcontractor.com/articles/99035-omnia-exterior-solutions-appoints-jeffery-kizilbash-as-ceo"",""https://www.prnewswire.com/news-releases/omnia-exterior-solutions-a-portfolio-company-of-ccmp-appoints-jeffery-kizilbash-as-chief-executive-officer-302020546.html""]},{""position"":""Head of Business Development"",""first_name"":""Nick"",""last_name"":""Bolen"",""email"":""nbolen@omniaexteriorsolutions.com"",""citations"":[""https://omniaexteriorsolutions.com/newsroom/omnia-exterior-solutions-a-portfolio-company-of-ccmp-growth-advisors-appoints-nick-bolen-as-chief-revenue-officer/""]}]",0,0,0,0,0,0,0,0,0,0
Best Choice Roofing,,"{""grade"":""F"",""summary"":""Unable to provide an investment grade for 'Best Choice Roofing' due to insufficient information. The input indicates that a specific state location is needed to conduct an accurate search and analysis. Without knowing which state's 'Best Choice Roofing' entity to evaluate, it's impossible to assess revenue growth, company size, ownership structure, or industry reputation. Multiple roofing companies operate under similar names across different states, making identification of the specific target company impossible without additional location information."",""citations"":[]}","[{""metric_name"":""est_annual_revenue"",""metric"":""Cannot be determined"",""details"":""Insufficient information provided. The input only contains a request for location specification and does not include any company financial data or identifying information beyond a generic business name."",""citations"":[]},{""metric_name"":""est_yoy_growth"",""metric"":""Cannot be determined"",""details"":""No growth data available from the provided input. Multiple companies may operate under this name across different states."",""citations"":[]},{""metric_name"":""can_accommodate_allocation"",""metric"":""Cannot be determined"",""details"":""Unable to assess capacity for $10M allocation without revenue, company size, or operational scale information."",""citations"":[]},{""metric_name"":""company_size"",""metric"":""Cannot be determined"",""details"":""Company size cannot be determined without specific location and additional identifying information."",""citations"":[]},{""metric_name"":""pe_backed"",""metric"":""Cannot be determined"",""details"":""Ownership structure unknown based on provided information."",""citations"":[]},{""metric_name"":""reputation"",""metric"":""Cannot be determined"",""details"":""Industry reputation cannot be assessed without specific company identification and location."",""citations"":[]}]",https://bestchoiceroofing.com/,"[{""position"":""CEO"",""first_name"":""Rob"",""last_name"":""Lowe"",""email"":""rob.lowe@bestchoiceroofing.com"",""citations"":[""https://bestchoiceroofing.com/about-our-ceo/""]},{""position"":""Founder"",""first_name"":""Wayne"",""last_name"":""Holloway"",""email"":""wayne.holloway@bestchoiceroofing.com"",""citations"":[""https://bestchoiceroofing.com/about-our-ceo/"",""https://bestchoiceroofing.com/blog/best-choice-roofing-receives-owens-cornings-nations-largest-platinum-preferred-contractor-award-for-third-consecutive-year/""]}]",0,0,0,0,155,0,0,0,0,6750
Corey Construction,TX,"{""grade"":""C"",""summary"":""Corey Construction receives a C grade due to several critical information gaps. While the company has positive indicators including being ranked in the Top 10 U.S. roofing contractors for 2023 and having experienced 'rapid growth,' there is insufficient concrete financial data to properly evaluate the investment opportunity. The lack of specific revenue figures, year-over-year growth metrics, and detailed financial information makes it impossible to assess whether the company can accommodate a $10 million capital allocation. The employee count (166-243) suggests a mid-sized operation, but without revenue data, we cannot determine if this size translates to sufficient scale. Positively, there's no indication of current private equity ownership, and the company has a strong industry reputation as evidenced by its top 10 ranking. The grade would likely improve significantly with access to actual financial statements and growth metrics."",""citations"":[""https://www.coreyconstruction.net/about-commercial-and-multifamily"",""https://recruiting.paylocity.com/recruiting/jobs/Details/3173555/CMG-Services-LLC/Regional-Service-Sales-Manager---Houston"",""https://www.roofingcontractor.com/articles/98523-the-top-10-roofing-contractors-for-2023"",""https://www.zoominfo.com/pic/corey-construction-llc/30217780""]}","[{""metric_name"":""est_annual_revenue"",""metric"":""Unknown"",""details"":""No specific revenue figures are publicly available in the search results"",""citations"":[""https://www.coreyconstruction.net/about-commercial-and-multifamily"",""https://www.zoominfo.com/pic/corey-construction-llc/30217780""]},{""metric_name"":""est_yoy_growth"",""metric"":""Unknown"",""details"":""Company has experienced rapid growth but specific year-over-year revenue growth figures are not publicly detailed"",""citations"":[""https://www.coreyconstruction.net/about-commercial-and-multifamily""]},{""metric_name"":""can_accommodate_allocation"",""metric"":false,""details"":""Without specific revenue or asset figures, it's difficult to definitively assess capacity to accommodate a $10 million capital allocation despite substantial operations"",""citations"":[""https://www.zoominfo.com/pic/corey-construction-llc/30217780""]},{""metric_name"":""company_size"",""metric"":""205"",""details"":""Employee counts vary with sources reporting 243 employees and 166 staff, averaging approximately 205 employees"",""citations"":[""https://www.zoominfo.com/pic/corey-construction-llc/30217780"",""https://www.roofingcontractor.com/articles/98523-the-top-10-roofing-contractors-for-2023""]},{""metric_name"":""pe_backed"",""metric"":false,""details"":""No direct indication that Corey Construction is currently backed by a private equity firm"",""citations"":[""https://www.roofingcontractor.com/articles/98523-the-top-10-roofing-contractors-for-2023""]},{""metric_name"":""reputation"",""metric"":""A"",""details"":""Recognized as one of the top ten roofing companies in the United States and listed among the Top 10 Roofing Contractors for 2023"",""citations"":[""https://www.coreyconstruction.net/about-commercial-and-multifamily"",""https://www.roofingcontractor.com/articles/98523-the-top-10-roofing-contractors-for-2023""]}]",https://www.coreyconstruction.net/,"[{""position"":""Division President"",""first_name"":""Justin"",""last_name"":""Tankersley"",""citations"":[""https://www.coreyconstruction.net/about-commercial-and-multifamily""]},{""position"":""Regional Vice President"",""first_name"":""James"",""last_name"":""Huddleston"",""citations"":[""https://www.coreyconstruction.net/about-commercial-and-multifamily""]},{""position"":""Leader"",""first_name"":""Bryan"",""last_name"":""Huddleston"",""citations"":[""https://www.coreyconstruction.net/about-us""]}]",0,0,0,0,0,0,0,0,0,0
BEST Contracting Services Inc,CA,"{""grade"":""C"",""summary"":""BEST Contracting Services, Inc. receives a C grade due to mixed performance against the investment criteria. While the company demonstrates adequate size to accommodate a $10 million capital allocation (with revenues between $84.5-136.5 million) and appears to be independent of private equity ownership, there are significant gaps in available data. Most critically, there is no evidence of consistent year-over-year revenue growth for the past five years, which is a key requirement for an A grade. The varying revenue estimates across different sources and years (2016: $118.4M, current estimates: $84.5M-$136.5M) suggest potential revenue volatility or decline rather than growth. The company's description as a 'large specialty contractor' and its apparent independence from private equity roll-ups are positive factors, but the lack of revenue growth data and limited information about industry reputation prevent a higher grade."",""citations"":[""https://www.zoominfo.com/c/best-contracting-services-inc/32609129"",""https://growjo.com/company/Best_Contracting_Services"",""https://www.roofingcontractor.com/2017/9-Best-Contracting"",""https://www.linkedin.com/company/best-contracting""]}","[{""metric_name"":""est_annual_revenue"",""metric"":""$136.5M"",""details"":""ZoomInfo reports estimated annual revenue of $136.5 million, while Growjo estimates $84.5 million. Using the higher estimate as current."",""citations"":[""https://www.zoominfo.com/c/best-contracting-services-inc/32609129"",""https://growjo.com/company/Best_Contracting_Services""]},{""metric_name"":""est_yoy_growth"",""metric"":""Unknown"",""details"":""No consistent year-over-year revenue growth data for the past five years is readily available from the search results."",""citations"":[]},{""metric_name"":""can_accommodate_allocation"",""metric"":true,""details"":""Company operates at scale with $84.5M-$136.5M annual revenue and is described as a 'large specialty contractor', indicating ability to accommodate $10M capital allocation."",""citations"":[""https://www.zoominfo.com/c/best-contracting-services-inc/32609129"",""https://bestcontracting.com/""]},{""metric_name"":""company_size"",""metric"":""380 employees"",""details"":""Employee counts vary across sources: LinkedIn reports 300, ZoomInfo reports 380, and 2017 data showed 450 employees. Using ZoomInfo's current estimate."",""citations"":[""https://www.zoominfo.com/pic/best-contracting-services-inc/32609129"",""https://www.linkedin.com/company/best-contracting""]},{""metric_name"":""pe_backed"",""metric"":false,""details"":""No indication of private equity backing. LinkedIn profile suggests they stand apart from 'private equity roll-ups' and ZoomInfo lists as 'Private' with no public funding information."",""citations"":[""https://www.linkedin.com/company/best-contracting"",""https://www.zoominfo.com/c/best-contracting-services-inc/32609129""]},{""metric_name"":""reputation"",""metric"":""B+"",""details"":""Ranked #9 in Top 100 Roofing Contractors list and described as 'large specialty contractor' indicating strong industry standing, though limited reputation data available."",""citations"":[""https://www.roofingcontractor.com/2017/9-Best-Contracting""]}]",https://bestcontracting.com/,"[{""position"":""CFO"",""first_name"":""Sean"",""last_name"":""Taba"",""email"":""staba@bestcontracting.com"",""citations"":[""https://www.linkedin.com/in/sean-taba-445a6142"",""https://bestcontracting.com/about-best/executive-leadership/""]},{""position"":""President"",""first_name"":""Kayhan"",""last_name"":""Fatemi"",""email"":""kfatemi@bestcontracting.com"",""citations"":[""https://bestcontracting.com/about-best/executive-leadership/""]},{""position"":""Vice President"",""first_name"":""Tony"",""last_name"":""Esfahani"",""citations"":[""https://bestcontracting.com/about-best/executive-leadership/""]},{""position"":""Vice President"",""first_name"":""Jesse"",""last_name"":""Torres"",""citations"":[""https://www.linkedin.com/in/jessetorres"",""https://bestcontracting.com/about-best/executive-leadership/""]},{""position"":""Head of Strategy"",""first_name"":""Ryan"",""last_name"":""Garcia"",""citations"":[""https://bestcontracting.com/about-best/executive-leadership/""]}]",611,592,0,0,0,1199687,1138584,0,0,0
