"Collis Roofing, Inc.",,"{""grade"":""C"",""summary"":""While Collis Roofing demonstrates strong industry reputation as Florida's largest residential and second-largest commercial roofer with excellent certifications (GAF top 1%, Owens Corning Platinum Preferred), the available information lacks critical financial data needed for an investment-grade assessment. There is no information about revenue, revenue growth trends, current ownership structure, or company size/valuation to determine if it can accommodate a $10M capital allocation. The company's 30-year operating history and market leadership position are positive indicators, but without financial metrics and ownership details, a higher grade cannot be justified."",""citations"":[""https://www.collisroofing.com/"",""https://www.linkedin.com/company/collis-roofing-inc-"",""https://www.collisroofing.com/About-Us"",""https://www.bbb.org/us/fl/longwood/profile/roofing-contractors/collis-roofing-inc-0733-102052""]}","[{""metric_name"":""est_annual_revenue"",""metric"":""50-100M"",""details"":""Based on being the largest residential and second-largest commercial roofer in Florida, estimated revenue range of $50-100M annually"",""citations"":[""https://www.collisroofing.com/"",""https://www.linkedin.com/company/collis-roofing-inc-""]},{""metric_name"":""est_yoy_growth"",""metric"":""5-15%"",""details"":""Estimated growth range based on established market position and ongoing recognition in roofing industry"",""citations"":[""https://www.collisroofing.com/About-Us""]},{""metric_name"":""can_accommodate_allocation"",""metric"":true,""details"":""As the largest residential roofer in Florida with 30+ years of operations, company size appears sufficient to accommodate $10M allocation"",""citations"":[""https://www.collisroofing.com/"",""https://www.linkedin.com/company/collis-roofing-inc-""]},{""metric_name"":""company_size"",""metric"":""Medium-Large"",""details"":""Largest residential and second-largest commercial roofer in Florida indicates medium to large company size"",""citations"":[""https://www.collisroofing.com/"",""https://www.linkedin.com/company/collis-roofing-inc-""]},{""metric_name"":""pe_backed"",""metric"":false,""details"":""Company is described as family-owned and operated since 1994"",""citations"":[""https://www.collisroofing.com/About-Us""]},{""metric_name"":""reputation"",""metric"":""A"",""details"":""Top 1% GAF rating, 2024 Owens Corning Platinum Preferred Product Excellence Winner, 2012 Residential Roofing Contractor of the Year"",""citations"":[""https://www.collisroofing.com/About-Us"",""https://www.bbb.org/us/fl/longwood/profile/roofing-contractors/collis-roofing-inc-0733-102052""]}]",https://www.collisroofing.com/,"[{""position"":""CFO"",""first_name"":""Jim"",""last_name"":""Steele"",""email"":""jsteele@collisroofing.com"",""citations"":[""https://rocketreach.co/collis-roofing-inc-management_b5e7c84df42e5b84""]},{""position"":""Founder"",""first_name"":""Douglas"",""last_name"":""Lanier"",""email"":""dlanier@collisroofing.com"",""citations"":[""https://www.collisroofing.com/About-Us"",""https://www.bbb.org/us/fl/st-augustine/profile/roofing-contractors/collis-roofing-inc-0403-235960988""]},{""position"":""President"",""first_name"":""Douglas"",""last_name"":""Lanier"",""email"":""dlanier@collisroofing.com"",""citations"":[""https://www.bbb.org/us/fl/st-augustine/profile/roofing-contractors/collis-roofing-inc-0403-235960988"",""https://www.roofingcontractor.com/articles/89145-versatile-dependable-financially-sound-collis-roofng""]},{""position"":""Vice President"",""first_name"":""Robby"",""last_name"":""Staats"",""citations"":[""https://rocketreach.co/collis-roofing-inc-management_b5e7c84df42e5b84"",""https://www.linkedin.com/in/robby-staats-17985b44""]},{""position"":""Vice President"",""first_name"":""Joyce"",""last_name"":""Lanier"",""citations"":[""https://www.bbb.org/us/fl/st-augustine/profile/roofing-contractors/collis-roofing-inc-0403-235960988""]}]",0,0,217,180,0,0,0,451360,383760,0
Hargrove Roofing LLC,,"{""grade"":""F"",""summary"":""Hargrove Roofing LLC receives an F grade due to insufficient information to evaluate against any of the key investment criteria. The available data only confirms the company's existence and geographic presence across Louisiana, Texas, and Tennessee. There is no public information regarding: (1) year-over-year revenue growth history, (2) company size or ability to accommodate a $10 million capital allocation, (3) current ownership structure or whether it's already PE-backed, or (4) industry reputation metrics. The limited information available consists only of location data and employee profiles, which is inadequate for making an investment decision. Without financial data, ownership information, or performance metrics, this opportunity cannot be properly evaluated and must be declined."",""citations"":[""https://www.zoominfo.com/c/hargrove-roofing-llc/448318431"",""https://www.linkedin.com/pub/dir/Rob/Hargrove"",""https://www.facebook.com/badonsolutions/posts/see-this-beauty-another-badon-barrier-roofing-system-install-wrapped-up-to-perfe/703433495776378/"",""https://www.linkedin.com/in/stephaniepaigegray"",""https://www.instagram.com/hudcoroofing/?hl=en"",""https://www.indeed.com/q-roofing-sales-l-tennessee-jobs.html""]}","[{""metric_name"":""est_annual_revenue"",""metric"":""Unknown"",""details"":""No public information available regarding revenue figures for Hargrove Roofing LLC"",""citations"":[""https://www.zoominfo.com/c/hargrove-roofing-llc/448318431""]},{""metric_name"":""est_yoy_growth"",""metric"":""Unknown"",""details"":""No public information available regarding year-over-year revenue growth for Hargrove Roofing LLC"",""citations"":[""https://www.zoominfo.com/c/hargrove-roofing-llc/448318431""]},{""metric_name"":""can_accommodate_allocation"",""metric"":""Unknown"",""details"":""No explicit details available about whether the company is of a size to accommodate a $10 million capital allocation"",""citations"":[""https://www.zoominfo.com/c/hargrove-roofing-llc/448318431""]},{""metric_name"":""company_size"",""metric"":""Unknown"",""details"":""Company size information not available in the provided data"",""citations"":[""https://www.zoominfo.com/c/hargrove-roofing-llc/448318431""]},{""metric_name"":""pe_backed"",""metric"":false,""details"":""No public information available indicating the company is currently backed by another private equity firm"",""citations"":[""https://www.zoominfo.com/c/hargrove-roofing-llc/448318431""]},{""metric_name"":""reputation"",""metric"":""Unknown"",""details"":""Insufficient information available to assess industry reputation"",""citations"":[""https://www.zoominfo.com/c/hargrove-roofing-llc/448318431""]}]",https://www.hargroveroofing.com/,"[{""position"":""Founder"",""first_name"":""Billy"",""last_name"":""Hargrove"",""email"":""billy@hargroveroofing.com"",""citations"":[""https://www.hargroveroofing.com/staff-profiles/""]},{""position"":""CEO"",""first_name"":""Anna"",""last_name"":""Brocato"",""citations"":[""https://www.hargroveroofing.com/about-us/""]},{""position"":""COO"",""first_name"":""Ed"",""last_name"":""Adams"",""citations"":[""https://www.roofingcontractor.com/articles/100641-hargrove-roofing-welcomes-ed-adams-as-new-coo"",""https://shrevepossible.com/hargrove-roofing-welcomes-new-coo-ed-adams/""]},{""position"":""Chief Financial Officer"",""first_name"":""Anna"",""last_name"":""Cox"",""email"":""anna@hargroveroofing.com""}]",0,0,46,0,0,0,0,85644,0,0
Bartlett Homes & Roofing LLC,,"{""grade"":""D"",""summary"":""Bartlett Homes & Roofing LLC receives a D grade due to insufficient information to assess key investment criteria. While the company has been in business since 1992 and has completed over 12,000 projects since 2013, there is no financial data available to evaluate revenue growth or company size. The available information suggests this is likely a small-to-medium regional contractor operating across 5 states, which may not be large enough to accommodate a $10M capital allocation. The company has BBB accreditation and appears to maintain operations, but without revenue figures, profitability data, or ownership structure details, it's impossible to determine if it meets private equity investment standards. The lack of transparency and publicly available financial information is a significant red flag for institutional investment consideration."",""citations"":[""https://bartlettroofs.com/"",""https://www.bbb.org/us/id/boise/profile/roofing-contractors/bartlett-homes-and-roofing-llc-1296-1000018036"",""https://www.linkedin.com/company/bartlettroofing""]}","[{""metric_name"":""est_annual_revenue"",""metric"":""$15-25 million"",""details"":""Estimated based on 12,000+ completed projects since 2013 (approximately 1,000+ projects per year) with average residential roofing project values of $15,000-25,000"",""citations"":[""https://www.linkedin.com/company/bartlettroofing""]},{""metric_name"":""est_yoy_growth"",""metric"":""5-15%"",""details"":""Estimated growth range for established roofing contractor with 32 years in business, operating across multiple states with consistent project volume"",""citations"":[""https://bartlettroofs.com/"",""https://www.linkedin.com/company/bartlettroofing""]},{""metric_name"":""can_accommodate_allocation"",""metric"":false,""details"":""Company appears too small to effectively utilize $10 million allocation based on estimated revenue and regional scope"",""citations"":[""https://www.linkedin.com/company/bartlettroofing"",""https://www.bbb.org/us/id/boise/profile/roofing-contractors/bartlett-homes-and-roofing-llc-1296-1000018036""]},{""metric_name"":""company_size"",""metric"":""Small-Medium"",""details"":""Regional roofing contractor serving 5 states with 1,000+ annual projects, founded in 1992, family-owned business"",""citations"":[""https://bartlettroofs.com/"",""https://www.linkedin.com/company/bartlettroofing""]},{""metric_name"":""pe_backed"",""metric"":false,""details"":""Family-owned business founded by Tom, Doug, and Steve Bartlett with no indication of private equity ownership"",""citations"":[""https://www.linkedin.com/company/bartlettroofing"",""https://secure.lni.wa.gov/verify/Detail.aspx?LIC=&UBI=604732399&SAW=""]},{""metric_name"":""reputation"",""metric"":""B+"",""details"":""BBB accredited since 2015, 32 years in business, 12,000+ completed projects, but limited visibility into customer reviews and industry recognition"",""citations"":[""https://www.bbb.org/us/id/boise/profile/roofing-contractors/bartlett-homes-and-roofing-llc-1296-1000018036"",""https://www.yelp.com/biz/bartlett-roofing-boise""]}]",https://bartlettroofs.com/,"[{""position"":""Founder"",""first_name"":""Doug"",""last_name"":""Bartlett"",""email"":""doug@bartlettroofs.com"",""citations"":[""https://www.linkedin.com/company/bartlettroofing"",""https://bartlettroofs.com/blog/bartlett-roofing-ranks-no-585-on-the-2021-inc-5000/""]},{""position"":""CEO"",""first_name"":""Doug"",""last_name"":""Bartlett"",""email"":""doug@bartlettroofs.com"",""citations"":[""https://www.owenscorning.com/en-us/roofing/contractors/contractor-profile/220513"",""https://muraena.ai/profile/doug_bartlett_e28ace53"",""https://rocketreach.co/bartlett-roofing-management_b4546da1fc9eaf14""]},{""position"":""Founder"",""first_name"":""Tom"",""last_name"":""Bartlett"",""citations"":[""https://www.linkedin.com/company/bartlettroofing""]},{""position"":""Founder"",""first_name"":""Steve"",""last_name"":""Bartlett"",""citations"":[""https://www.linkedin.com/company/bartlettroofing""]},{""position"":""COO"",""first_name"":""Roman"",""last_name"":""Burlo"",""citations"":[""https://rocketreach.co/bartlett-roofing-management_b4546da1fc9eaf14""]}]",0,0,130,159,208,0,0,270400,330760,425640
Westfall Roofing,,"{""grade"":""C"",""summary"":""Westfall Roofing demonstrates strong industry reputation with over 1,500 5-star Google reviews and ranking #51 among top 100 roofing contractors nationally. The company has 35+ years of operating history and appears to be family-owned (not PE-backed). However, critical financial information including revenue size, growth rates, and EBITDA are not available in the provided data. Without visibility into financial performance and company size, it's impossible to assess if they meet the revenue growth requirements or can accommodate a $10M capital allocation. The roofing industry in Florida is attractive due to weather-related demand, but more financial due diligence would be required to determine if this is an A-grade investment opportunity."",""citations"":[""https://www.westfallroofing.com/"",""https://www.westfallroofing.com/the-westfall-way/meet-the-team/"",""https://www.bbb.org/us/fl/tampa/profile/roofing-contractors/westfall-roofing-0653-46000935/complaints""]}","[{""metric_name"":""est_annual_revenue"",""metric"":""$5-15 million"",""details"":""Estimated based on 35+ years of operation, ranking #51 nationally among top 100 roofing contractors, strong online presence with 1,500+ Google reviews, and serving major Florida markets"",""citations"":[""https://www.westfallroofing.com/"",""https://www.westfallroofing.com/contact-us/""]},{""metric_name"":""est_yoy_growth"",""metric"":""5-15%"",""details"":""Estimated growth based on established market position in growing Florida construction market and strong reputation indicators"",""citations"":[""https://www.westfallroofing.com/"",""https://www.yelp.com/biz/westfall-roofing-tampa-3""]},{""metric_name"":""can_accommodate_allocation"",""metric"":false,""details"":""Regional roofing contractor likely too small to effectively utilize $10 million capital allocation based on typical revenue scale for this market position"",""citations"":[""https://www.westfallroofing.com/"",""https://www.westfallroofing.com/contact-us/""]},{""metric_name"":""company_size"",""metric"":""Small-Medium"",""details"":""Family-owned business operating since 1989 with 35+ years experience, ranked nationally but appears to be regional operation in Central/Southwest Florida"",""citations"":[""https://www.westfallroofing.com/the-westfall-way/meet-the-team/"",""https://www.westfallroofing.com/""]},{""metric_name"":""pe_backed"",""metric"":false,""details"":""Family-owned business founded by Kirk and Maria Westfall in 1989 with son Ryan joining in 2008, indicating continued family ownership"",""citations"":[""https://www.westfallroofing.com/the-westfall-way/meet-the-team/""]},{""metric_name"":""reputation"",""metric"":""A"",""details"":""Strong reputation evidenced by 1,500+ 5-star Google reviews, 1,000+ additional 5-star reviews, and ranking #51 out of top 100 roofing contractors nationally"",""citations"":[""https://www.westfallroofing.com/"",""https://www.westfallroofing.com/contact-us/"",""https://www.angi.com/companylist/us/fl/tampa/westfall-roofing-reviews-2332177.htm""]}]",https://www.westfallroofing.com/,"[{""position"":""CFO"",""first_name"":""Paul"",""last_name"":""Meyer"",""email"":""paul@westfallroofing.com"",""citations"":[""https://www.roofingcontractor.com/articles/100901-westfall-roofing-expands-c-suite-leadership"",""https://www.businessobserverfl.com/news/2025/jun/04/roofing-business-new-c-suite-leaders/""]},{""position"":""Founder"",""first_name"":""Kirk"",""last_name"":""Westfall"",""email"":""kirk@westfallroofing.com"",""citations"":[""https://www.westfallroofing.com/the-westfall-way/meet-the-team/"",""https://www.businessobserverfl.com/news/2025/mar/21/top-contractors/""]},{""position"":""Founder"",""first_name"":""Maria"",""last_name"":""Westfall"",""citations"":[""https://www.westfallroofing.com/the-westfall-way/meet-the-team/""]},{""position"":""President"",""first_name"":""Ryan"",""last_name"":""Westfall"",""citations"":[""https://www.westfallroofing.com/the-westfall-way/meet-the-team/"",""https://www.linkedin.com/in/ryan-westfall-467b0324"",""https://www.roofingcontractor.com/articles/100901-westfall-roofing-expands-c-suite-leadership"",""https://www.bizjournals.com/tampabay/news/2025/07/01/meet-westfall-roofing-a-2025-fast-50-honoree.html"",""https://www.businessobserverfl.com/news/2025/mar/21/top-contractors/""]},{""position"":""COO"",""first_name"":""Ryan"",""last_name"":""Westfall"",""citations"":[""https://www.roofingcontractor.com/articles/100901-westfall-roofing-expands-c-suite-leadership"",""https://www.bizjournals.com/tampabay/news/2025/07/01/meet-westfall-roofing-a-2025-fast-50-honoree.html""]}]",0,0,0,0,0,0,0,0,0,0
Stellar Roofing,TX,"{""grade"":""D"",""summary"":""Stellar Commercial Roofing fails to meet the key criteria for an A grade. Most critically, the company is owned by another private equity firm (Sun Capital Partners acquired parent company Cotton Holdings in January 2020), which automatically disqualifies it from an A rating. While the company shows positive attributes including solid revenue growth from $46.5M in 2021 to $57.7M in 2024 (approximately 24% growth over 3 years) and is of sufficient size to accommodate a $10M capital allocation, the private equity ownership is a fundamental disqualifier. Additionally, limited data is available regarding industry reputation, and we only have 3 years of revenue data rather than the full 5-year history needed for comprehensive evaluation."",""citations"":[""https://suncappart.com/2020/01/07/sun-capital-partners-affiliate-completes-acquisition-of-cotton-holdings-inc-a-global-leader-in-infrastructure-support-services/"",""https://apple-pomegranate-wjb8.squarespace.com/s/2024-Top-150-Roofing-Contractors-List-_-Roofing-Contractor.pdf"",""https://www.roofingcontractor.com/RC-List-Top-100-2021""]}","[{""metric_name"":""est_annual_revenue"",""metric"":57672369,""details"":""Latest reported revenue from 2024 Top 150 Roofing Contractors list showing $57,672,369"",""citations"":[""https://apple-pomegranate-wjb8.squarespace.com/s/2024-Top-150-Roofing-Contractors-List-_-Roofing-Contractor.pdf""]},{""metric_name"":""est_yoy_growth"",""metric"":7.5,""details"":""Average annual growth rate from 2021 revenue of $46,479,336 to 2024 revenue of $57,672,369 over 3-year period"",""citations"":[""https://apple-pomegranate-wjb8.squarespace.com/s/2024-Top-150-Roofing-Contractors-List-_-Roofing-Contractor.pdf"",""https://www.roofingcontractor.com/RC-List-Top-100-2021""]},{""metric_name"":""can_accommodate_allocation"",""metric"":true,""details"":""With $57.6 million in annual revenue, the company can comfortably accommodate a $10 million capital allocation representing approximately 17% of current revenue scale"",""citations"":[""https://apple-pomegranate-wjb8.squarespace.com/s/2024-Top-150-Roofing-Contractors-List-_-Roofing-Contractor.pdf""]},{""metric_name"":""company_size"",""metric"":""Mid-Market"",""details"":""Annual revenue of $57.6 million places company in mid-market segment for commercial roofing contractors"",""citations"":[""https://apple-pomegranate-wjb8.squarespace.com/s/2024-Top-150-Roofing-Contractors-List-_-Roofing-Contractor.pdf""]},{""metric_name"":""pe_backed"",""metric"":true,""details"":""Company is subsidiary of Cotton Holdings Inc., which was acquired by Sun Capital Partners affiliate on January 7, 2020"",""citations"":[""https://cottonholdings.com/investor-relations"",""https://suncappart.com/2020/01/07/sun-capital-partners-affiliate-completes-acquisition-of-cotton-holdings-inc-a-global-leader-in-infrastructure-support-services/""]},{""metric_name"":""reputation"",""metric"":""B"",""details"":""Company appears on industry Top 150 and Top 100 contractor lists with consistent growth, indicating solid industry standing though specific reputation metrics not detailed"",""citations"":[""https://apple-pomegranate-wjb8.squarespace.com/s/2024-Top-150-Roofing-Contractors-List-_-Roofing-Contractor.pdf"",""https://www.roofingcontractor.com/RC-List-Top-100-2021""]}]",https://stellarroofing.com/,"[{""position"":""President"",""first_name"":""Joe"",""last_name"":""Deane"",""citations"":[""https://stellarcommercialroofing.com/about/our-team"",""https://www.linkedin.com/in/joe-deane-ba8a31204""]},{""position"":""Founder"",""first_name"":""Don"",""last_name"":""Williams"",""citations"":[""https://stellarroofingandsolar.com/about/meet-the-team/""]}]",0,0,0,0,0,0,0,0,0,0
Rackley Roofing Co Inc,TN,"{""grade"":""F"",""summary"":""Rackley Roofing Co Inc receives an F grade due to insufficient data to evaluate against any of the key investment criteria. The research failed to provide critical information including: (1) year-over-year revenue growth data, (2) company size/revenue to assess capacity for $10 million capital allocation, (3) current ownership structure to confirm absence of PE backing, and (4) industry reputation metrics. Without this fundamental data, it is impossible to determine if the company meets any of the requirements for an investment-grade rating. The complete lack of available information suggests either the company is too small/private to have public data, or the research was inadequate."",""citations"":[]}","[{""metric_name"":""est_annual_revenue"",""metric"":""Unknown"",""details"":""No specific revenue information available for Rackley Roofing Co Inc in the provided search results"",""citations"":[]},{""metric_name"":""est_yoy_growth"",""metric"":""Unknown"",""details"":""Year-over-year revenue growth data not found in the initial search results"",""citations"":[]},{""metric_name"":""can_accommodate_allocation"",""metric"":""Unknown"",""details"":""Cannot determine if company can accommodate $10M allocation without revenue and size information"",""citations"":[]},{""metric_name"":""company_size"",""metric"":""Unknown"",""details"":""Company size information not available in the provided search results"",""citations"":[]},{""metric_name"":""pe_backed"",""metric"":false,""details"":""Search results did not definitively state whether the company is backed by a private equity firm"",""citations"":[]},{""metric_name"":""reputation"",""metric"":""Unknown"",""details"":""No industry reputation or rating information available for Rackley Roofing Co Inc"",""citations"":[]}]",https://rackleyroofing.com/,"[{""position"":""CEO"",""first_name"":""Curtis"",""last_name"":""Sutton"",""email"":""curtis@rackleyroofing.com"",""citations"":[""https://www.linkedin.com/company/rackley-roofing"",""https://www.facebook.com/photo.php?fbid=5149250121752210&id=1186422001368395&set=a.1187460717931190"",""https://rackleywar.com/rackley-w-a-r-names-dawson-sutton-full-time-nascar-truck-series-driver-for-2025/""]},{""position"":""President"",""first_name"":""Curtis"",""last_name"":""Sutton"",""email"":""curtis@rackleyroofing.com"",""citations"":[""https://www.linkedin.com/company/rackley-roofing""]},{""position"":""COO"",""first_name"":""Michelle"",""last_name"":""Boykin"",""citations"":[""https://www.linkedin.com/company/rackley-roofing"",""https://www.nrca.net/RoofingNews/nrca-elects-2024-25-officers.2-13-2024.11947/details/story""]}]",109,120,123,122,93,260762,291481,259709,180182,244060
"Bartch Roofing Co., Inc.",MO,"{""grade"":""F"",""summary"":""Bartch Roofing Co., Inc. receives an F grade due to insufficient information to evaluate any of the key investment criteria. The search results provided no data on year-over-year revenue growth, company size, private equity ownership status, or industry reputation. The only information available consists of two peripheral mentions: one as a Sarnafil Waterproofing System installer and another in city meeting minutes. Without financial data, company size metrics, ownership information, or reputation indicators, it is impossible to assess whether this company meets any of the requirements for an investment-grade rating. The lack of publicly available financial and operational information itself is a significant red flag for potential investors."",""citations"":[""http://sweets.construction.com/swts_content_files/723/294109.pdf"",""https://core-docs.s3.us-east-1.amazonaws.com/documents/asset/uploaded_file/4410/CW/4369072/07-06-21.pdf""]}","[{""metric_name"":""est_annual_revenue"",""metric"":""Unknown"",""details"":""No financial data available in the provided search results"",""citations"":[]},{""metric_name"":""est_yoy_growth"",""metric"":""Unknown"",""details"":""No year-over-year revenue growth information found in search results"",""citations"":[]},{""metric_name"":""can_accommodate_allocation"",""metric"":false,""details"":""Cannot determine company size or financial capacity from available information to assess $10M allocation capability"",""citations"":[]},{""metric_name"":""company_size"",""metric"":""Unknown"",""details"":""Company size information not available in search results"",""citations"":[]},{""metric_name"":""pe_backed"",""metric"":false,""details"":""No indication of private equity backing found in search results"",""citations"":[]},{""metric_name"":""reputation"",""metric"":""C"",""details"":""Company appears to be an authorized Sarnafil Waterproofing System installer and is mentioned in city meeting minutes, suggesting operational presence but limited data for full assessment"",""citations"":[""http://sweets.construction.com/swts_content_files/723/294109.pdf"",""https://core-docs.s3.us-east-1.amazonaws.com/documents/asset/uploaded_file/4410/CW/4369072/07-06-21.pdf""]}]",https://www.bartchroofing.com/,"[{""position"":""Customer Relations Director"",""first_name"":""Frank"",""last_name"":""Baer"",""citations"":[""https://www.linkedin.com/in/frank-baer-38017017a""]},{""position"":""Special Projects Manager"",""first_name"":""Frank"",""last_name"":""Baer"",""citations"":[""https://www.linkedin.com/in/frank-baer-38017017a""]}]",49,36,35,92,25,80795,48608,59489,127663,62495
